[2025-10-31 14:51:55,390] 29 root - INFO - Entered the data ingestion method or component
[2025-10-31 14:51:55,422] 33 root - INFO - Read the dataset as dataframe
[2025-10-31 14:51:55,483] 40 root - INFO - Raw data saved successfully
[2025-10-31 14:51:55,483] 43 root - INFO - Train test split initiated
[2025-10-31 14:51:55,548] 50 root - INFO - Ingestion of the data is completed
[2025-10-31 14:51:55,549] 142 root - INFO - Starting data transformation
[2025-10-31 14:51:55,622] 145 root - INFO - Train and test files read into DataFrames
[2025-10-31 14:51:55,625] 155 root - INFO - Dropped identifier columns: ['Order_ID', 'Product_ID', 'User_ID']
[2025-10-31 14:51:55,642] 161 root - INFO - Date features extracted
[2025-10-31 14:51:55,644] 175 root - INFO - Separated input features and target
[2025-10-31 14:51:55,644] 85 root - INFO - Creating data transformer object
[2025-10-31 14:51:55,644] 130 root - INFO - Preprocessor (ColumnTransformer) created.
[2025-10-31 14:51:55,700] 207 root - INFO - Applied preprocessing to train and test sets
[2025-10-31 14:51:55,703] 18 root - INFO - Object saved successfully at artifacts\preprocessor.pkl
[2025-10-31 14:51:55,704] 18 root - INFO - Object saved successfully at artifacts\label_encoder.pkl
[2025-10-31 14:51:55,704] 216 root - INFO - Saved preprocessor to artifacts\preprocessor.pkl and label encoder to artifacts\label_encoder.pkl
[2025-10-31 14:51:55,706] 70 root - INFO - Model training initiated
[2025-10-31 14:51:55,707] 40 root - INFO - Training model: Logistic Regression
[2025-10-31 14:51:55,707] 45 root - INFO - Performing GridSearchCV for Logistic Regression
[2025-10-31 14:52:00,460] 49 root - INFO - Best params for Logistic Regression: {'C': 0.1, 'solver': 'lbfgs'}
[2025-10-31 14:52:00,461] 59 root - INFO - Logistic Regression Accuracy: 1.0000
[2025-10-31 14:52:00,462] 60 root - INFO - Confusion Matrix:
[[1344    0]
 [   0  656]]
[2025-10-31 14:52:00,469] 61 root - INFO - Classification Report:
              precision    recall  f1-score   support

         0.0       1.00      1.00      1.00      1344
         1.0       1.00      1.00      1.00       656

    accuracy                           1.00      2000
   macro avg       1.00      1.00      1.00      2000
weighted avg       1.00      1.00      1.00      2000

[2025-10-31 14:52:00,469] 40 root - INFO - Training model: Decision Tree
[2025-10-31 14:52:00,469] 45 root - INFO - Performing GridSearchCV for Decision Tree
[2025-10-31 14:52:02,239] 49 root - INFO - Best params for Decision Tree: {'criterion': 'gini', 'max_depth': None}
[2025-10-31 14:52:02,240] 59 root - INFO - Decision Tree Accuracy: 1.0000
[2025-10-31 14:52:02,242] 60 root - INFO - Confusion Matrix:
[[1344    0]
 [   0  656]]
[2025-10-31 14:52:02,248] 61 root - INFO - Classification Report:
              precision    recall  f1-score   support

         0.0       1.00      1.00      1.00      1344
         1.0       1.00      1.00      1.00       656

    accuracy                           1.00      2000
   macro avg       1.00      1.00      1.00      2000
weighted avg       1.00      1.00      1.00      2000

[2025-10-31 14:52:02,248] 40 root - INFO - Training model: Random Forest
[2025-10-31 14:52:02,248] 45 root - INFO - Performing GridSearchCV for Random Forest
[2025-10-31 14:52:07,203] 49 root - INFO - Best params for Random Forest: {'max_depth': None, 'min_samples_split': 2, 'n_estimators': 50}
[2025-10-31 14:52:07,209] 59 root - INFO - Random Forest Accuracy: 1.0000
[2025-10-31 14:52:07,210] 60 root - INFO - Confusion Matrix:
[[1344    0]
 [   0  656]]
[2025-10-31 14:52:07,216] 61 root - INFO - Classification Report:
              precision    recall  f1-score   support

         0.0       1.00      1.00      1.00      1344
         1.0       1.00      1.00      1.00       656

    accuracy                           1.00      2000
   macro avg       1.00      1.00      1.00      2000
weighted avg       1.00      1.00      1.00      2000

[2025-10-31 14:52:07,216] 40 root - INFO - Training model: Gradient Boosting
[2025-10-31 14:52:07,216] 45 root - INFO - Performing GridSearchCV for Gradient Boosting
[2025-10-31 14:52:15,716] 49 root - INFO - Best params for Gradient Boosting: {'learning_rate': 0.01, 'max_depth': 3, 'n_estimators': 50}
[2025-10-31 14:52:15,719] 59 root - INFO - Gradient Boosting Accuracy: 1.0000
[2025-10-31 14:52:15,720] 60 root - INFO - Confusion Matrix:
[[1344    0]
 [   0  656]]
[2025-10-31 14:52:15,725] 61 root - INFO - Classification Report:
              precision    recall  f1-score   support

         0.0       1.00      1.00      1.00      1344
         1.0       1.00      1.00      1.00       656

    accuracy                           1.00      2000
   macro avg       1.00      1.00      1.00      2000
weighted avg       1.00      1.00      1.00      2000

[2025-10-31 14:52:15,725] 40 root - INFO - Training model: SVM
[2025-10-31 14:52:15,725] 45 root - INFO - Performing GridSearchCV for SVM
[2025-10-31 14:52:18,397] 49 root - INFO - Best params for SVM: {'C': 0.1, 'kernel': 'linear'}
[2025-10-31 14:52:18,406] 59 root - INFO - SVM Accuracy: 1.0000
[2025-10-31 14:52:18,408] 60 root - INFO - Confusion Matrix:
[[1344    0]
 [   0  656]]
[2025-10-31 14:52:18,413] 61 root - INFO - Classification Report:
              precision    recall  f1-score   support

         0.0       1.00      1.00      1.00      1344
         1.0       1.00      1.00      1.00       656

    accuracy                           1.00      2000
   macro avg       1.00      1.00      1.00      2000
weighted avg       1.00      1.00      1.00      2000

[2025-10-31 14:52:18,414] 120 root - INFO - Best Model: Logistic Regression with Accuracy: 1.0000
[2025-10-31 14:52:18,415] 18 root - INFO - Object saved successfully at artifacts\model.pkl
[2025-10-31 14:52:18,415] 128 root - INFO - Best model saved at artifacts\model.pkl
