[2025-10-31 14:48:11,249] 29 root - INFO - Entered the data ingestion method or component
[2025-10-31 14:48:11,280] 33 root - INFO - Read the dataset as dataframe
[2025-10-31 14:48:11,346] 40 root - INFO - Raw data saved successfully
[2025-10-31 14:48:11,346] 43 root - INFO - Train test split initiated
[2025-10-31 14:48:11,410] 50 root - INFO - Ingestion of the data is completed
[2025-10-31 14:48:11,411] 142 root - INFO - Starting data transformation
[2025-10-31 14:48:11,485] 145 root - INFO - Train and test files read into DataFrames
[2025-10-31 14:48:11,488] 155 root - INFO - Dropped identifier columns: ['Order_ID', 'Product_ID', 'User_ID']
[2025-10-31 14:48:11,505] 161 root - INFO - Date features extracted
[2025-10-31 14:48:11,507] 175 root - INFO - Separated input features and target
[2025-10-31 14:48:11,507] 85 root - INFO - Creating data transformer object
[2025-10-31 14:48:11,507] 130 root - INFO - Preprocessor (ColumnTransformer) created.
[2025-10-31 14:48:11,564] 207 root - INFO - Applied preprocessing to train and test sets
[2025-10-31 14:48:11,568] 18 root - INFO - Object saved successfully at artifacts\preprocessor.pkl
[2025-10-31 14:48:11,569] 18 root - INFO - Object saved successfully at artifacts\label_encoder.pkl
[2025-10-31 14:48:11,569] 216 root - INFO - Saved preprocessor to artifacts\preprocessor.pkl and label encoder to artifacts\label_encoder.pkl
[2025-10-31 14:48:11,571] 71 root - INFO - Model training initiated
[2025-10-31 14:48:11,571] 39 root - INFO - Training model: Logistic Regression
[2025-10-31 14:48:11,571] 44 root - INFO - Performing GridSearchCV for Logistic Regression
[2025-10-31 14:48:16,190] 48 root - INFO - Best params for Logistic Regression: {'C': 0.1, 'solver': 'lbfgs'}
[2025-10-31 14:48:16,191] 57 root - INFO - Logistic Regression Accuracy: 1.0000
[2025-10-31 14:48:16,192] 58 root - INFO - Confusion Matrix for Logistic Regression:
[[1344    0]
 [   0  656]]
[2025-10-31 14:48:16,197] 59 root - INFO - Classification Report for Logistic Regression:
              precision    recall  f1-score   support

         0.0       1.00      1.00      1.00      1344
         1.0       1.00      1.00      1.00       656

    accuracy                           1.00      2000
   macro avg       1.00      1.00      1.00      2000
weighted avg       1.00      1.00      1.00      2000

[2025-10-31 14:48:16,197] 39 root - INFO - Training model: Decision Tree
[2025-10-31 14:48:16,197] 44 root - INFO - Performing GridSearchCV for Decision Tree
[2025-10-31 14:48:17,977] 48 root - INFO - Best params for Decision Tree: {'criterion': 'gini', 'max_depth': None}
[2025-10-31 14:48:17,979] 57 root - INFO - Decision Tree Accuracy: 1.0000
[2025-10-31 14:48:17,981] 58 root - INFO - Confusion Matrix for Decision Tree:
[[1344    0]
 [   0  656]]
[2025-10-31 14:48:17,985] 59 root - INFO - Classification Report for Decision Tree:
              precision    recall  f1-score   support

         0.0       1.00      1.00      1.00      1344
         1.0       1.00      1.00      1.00       656

    accuracy                           1.00      2000
   macro avg       1.00      1.00      1.00      2000
weighted avg       1.00      1.00      1.00      2000

[2025-10-31 14:48:17,985] 39 root - INFO - Training model: Random Forest
[2025-10-31 14:48:17,985] 44 root - INFO - Performing GridSearchCV for Random Forest
[2025-10-31 14:48:23,022] 48 root - INFO - Best params for Random Forest: {'max_depth': None, 'min_samples_split': 2, 'n_estimators': 50}
[2025-10-31 14:48:23,030] 57 root - INFO - Random Forest Accuracy: 1.0000
[2025-10-31 14:48:23,032] 58 root - INFO - Confusion Matrix for Random Forest:
[[1344    0]
 [   0  656]]
[2025-10-31 14:48:23,037] 59 root - INFO - Classification Report for Random Forest:
              precision    recall  f1-score   support

         0.0       1.00      1.00      1.00      1344
         1.0       1.00      1.00      1.00       656

    accuracy                           1.00      2000
   macro avg       1.00      1.00      1.00      2000
weighted avg       1.00      1.00      1.00      2000

[2025-10-31 14:48:23,037] 39 root - INFO - Training model: Gradient Boosting
[2025-10-31 14:48:23,037] 44 root - INFO - Performing GridSearchCV for Gradient Boosting
[2025-10-31 14:48:33,770] 48 root - INFO - Best params for Gradient Boosting: {'learning_rate': 0.01, 'max_depth': 3, 'n_estimators': 50}
[2025-10-31 14:48:33,776] 57 root - INFO - Gradient Boosting Accuracy: 1.0000
[2025-10-31 14:48:33,779] 58 root - INFO - Confusion Matrix for Gradient Boosting:
[[1344    0]
 [   0  656]]
[2025-10-31 14:48:33,790] 59 root - INFO - Classification Report for Gradient Boosting:
              precision    recall  f1-score   support

         0.0       1.00      1.00      1.00      1344
         1.0       1.00      1.00      1.00       656

    accuracy                           1.00      2000
   macro avg       1.00      1.00      1.00      2000
weighted avg       1.00      1.00      1.00      2000

[2025-10-31 14:48:33,790] 39 root - INFO - Training model: SVM
[2025-10-31 14:48:33,790] 44 root - INFO - Performing GridSearchCV for SVM
[2025-10-31 14:48:36,647] 48 root - INFO - Best params for SVM: {'C': 0.1, 'kernel': 'linear'}
[2025-10-31 14:48:36,656] 57 root - INFO - SVM Accuracy: 1.0000
[2025-10-31 14:48:36,658] 58 root - INFO - Confusion Matrix for SVM:
[[1344    0]
 [   0  656]]
[2025-10-31 14:48:36,662] 59 root - INFO - Classification Report for SVM:
              precision    recall  f1-score   support

         0.0       1.00      1.00      1.00      1344
         1.0       1.00      1.00      1.00       656

    accuracy                           1.00      2000
   macro avg       1.00      1.00      1.00      2000
weighted avg       1.00      1.00      1.00      2000

[2025-10-31 14:48:36,663] 121 root - INFO - Best Model: Logistic Regression with Accuracy: 1.0000
[2025-10-31 14:48:36,663] 18 root - INFO - Object saved successfully at artifacts\model.pkl
[2025-10-31 14:48:36,663] 129 root - INFO - Best model saved at artifacts\model.pkl
